bill_id,number,change_hash,url,status_date,status,last_action_date,last_action,title,description
1948575,A03930,cf958492fd7b6fba87a5c558afd2cacb,https://legiscan.com/NY/bill/A03930/2025,2025-01-30,1,2026-01-07,referred to housing,Regulates the use of artificial intelligence in aiding decisions on rental housing and loans; requires a study on the impact of artificial intelligence and machine learning on housing discrimination and redlining.,Regulates the use of artificial intelligence in aiding decisions on rental housing and loans; requires a study on the impact of artificial intelligence and machine learning on housing discrimination and redlining.
1948871,A03965,48fc6b08fd2689e51bf7ae645ea12796,https://legiscan.com/NY/bill/A03965/2025,2025-01-30,1,2026-01-07,referred to housing,Relates to alternative project delivery contracts for certain construction projects by housing authorities.,Relates to alternative project delivery contracts for certain construction projects by housing authorities.
1949118,A03996,d8d64246e3bc1fce27f838b22fbd7dea,https://legiscan.com/NY/bill/A03996/2025,2025-01-30,1,2026-01-07,referred to housing,"Establishes a jobs and housing pilot program to create jobs in the construction industry and address the housing crisis by developing or redeveloping housing that is affordable to individuals earning up to one hundred thirty percent of the area median income, adjusted for family size.","Establishes a jobs and housing pilot program to create jobs in the construction industry and address the housing crisis by developing or redeveloping housing that is affordable to individuals earning up to one hundred thirty percent of the area median income, adjusted for family size."
1948846,A03999,47fb50de11aae928fcf11803a5d74989,https://legiscan.com/NY/bill/A03999/2025,2025-01-30,1,2025-06-17,substituted by s2457b,"Establishes the mechanical insulation energy savings program to provide grants for qualified mechanical insulation expenditures to school districts, public hospitals, public housing buildings, and political subdivisions that have completed a qualified audit.","Establishes the mechanical insulation energy savings program to provide grants for qualified mechanical insulation expenditures to school districts, public hospitals, public housing buildings, and political subdivisions that have completed a qualified audit."
1948593,A04002,d2628e0b733d917c51f0fca47479d6aa,https://legiscan.com/NY/bill/A04002/2025,2025-01-30,1,2026-01-09,print number 4002a,Prohibits discriminatory advertisement practices in relation to the sale or renting of housing; allows for the division of human rights to investigate such occurrences.,Prohibits discriminatory advertisement practices in relation to the sale or renting of housing; allows for the division of human rights to investigate such occurrences.
1949582,A04040,4f87093a29ffe59cd5a1634db8bc9542,https://legiscan.com/NY/bill/A04040/2025,2025-12-19,4,2025-12-19,signed chap.649,"Codifies the disparate impact standard in the human rights law; provides that in cases of alleged housing discrimination, an unlawful discriminatory practice may be established by a practice's discriminatory effect.","Codifies the disparate impact standard in the human rights law; provides that in cases of alleged housing discrimination, an unlawful discriminatory practice may be established by a practice's discriminatory effect."
1950609,A04120,00bbf77b9a2c9e02f37daec182e2334c,https://legiscan.com/NY/bill/A04120/2025,2025-01-31,1,2026-01-07,referred to housing,"Protects renters using a housing subsidy or voucher, or receiving public assistance from discrimination by the housing provider based on such renters' income or use of such housing subsidy, voucher or public assistance.","Protects renters using a housing subsidy or voucher, or receiving public assistance from discrimination by the housing provider based on such renters' income or use of such housing subsidy, voucher or public assistance."
1950244,A04191,f6ca7ca387dc3eb142aedd2a9276871c,https://legiscan.com/NY/bill/A04191/2025,2025-01-31,1,2026-01-07,referred to aging,"Establishes the bureau of the senior tenants' advocate within the state office for the aging; provides that the senior tenants' advocate shall assist senior citizen tenants in resolving complaints they may have with the New York state division of housing and community renewal, landlord disputes, rent increases, and other housing related matters; provides that the governor shall appoint the senior tenants' advocate.","Establishes the bureau of the senior tenants' advocate within the state office for the aging; provides that the senior tenants' advocate shall assist senior citizen tenants in resolving complaints they may have with the New York state division of housing and community renewal, landlord disputes, rent increases, and other housing related matters; provides that the governor shall appoint the senior tenants' advocate."
1953948,A04284,25353f48816b1f449267a79e8fe3792a,https://legiscan.com/NY/bill/A04284/2025,2025-02-04,1,2026-01-07,referred to judiciary,Expands the right to seek the appointment of administrators of buildings to tenants and local governments throughout the state and to make procedures conform with realities of housing stock throughout the state.,Expands the right to seek the appointment of administrators of buildings to tenants and local governments throughout the state and to make procedures conform with realities of housing stock throughout the state.
1953551,A04319,f47398a18f7fbe8324ef7cd96890860e,https://legiscan.com/NY/bill/A04319/2025,2025-02-04,1,2026-01-07,referred to governmental operations,Includes correctional facilities and local correctional facilities as publicly-assisted housing accommodations for purposes of the division of human rights; defines correctional facilities and local correctional facilities.,Includes correctional facilities and local correctional facilities as publicly-assisted housing accommodations for purposes of the division of human rights; defines correctional facilities and local correctional facilities.
1953355,A04325,0c4c9a6851ed70527afc96aa543b5886,https://legiscan.com/NY/bill/A04325/2025,2025-02-04,1,2026-01-07,referred to correction,"Requires the department of corrections and community supervision to establish discharge plans and reentry services for wrongfully convicted individuals upon their discharge which includes housing needs, educational needs, employment needs, medical needs, and specific social service needs.","Requires the department of corrections and community supervision to establish discharge plans and reentry services for wrongfully convicted individuals upon their discharge which includes housing needs, educational needs, employment needs, medical needs, and specific social service needs."
1953502,A04334,4fa6fb9839f5089e253531137a5d13aa,https://legiscan.com/NY/bill/A04334/2025,2025-02-04,1,2026-01-07,referred to housing,Requires rent reduction in cases of submetered utility service; directs the division of housing and community renewal to develop a standard reduction and an appeals process.,Requires rent reduction in cases of submetered utility service; directs the division of housing and community renewal to develop a standard reduction and an appeals process.
1953644,A04432,08593c0d4df3de2b6109374cfc2f3c8b,https://legiscan.com/NY/bill/A04432/2025,2025-02-04,1,2026-01-07,referred to governmental operations,"Relates to rental discrimination based upon consumer credit history; prohibits a person from refusing to rent or lease or otherwise to deny to or withhold from any person or group of persons housing accommodations because of the consumer credit history of such person or persons, or to represent that any housing accommodation is not available for rental or lease when in fact it is so available; defines consumer credit history.","Relates to rental discrimination based upon consumer credit history; prohibits a person from refusing to rent or lease or otherwise to deny to or withhold from any person or group of persons housing accommodations because of the consumer credit history of such person or persons, or to represent that any housing accommodation is not available for rental or lease when in fact it is so available; defines consumer credit history."
1953812,A04465,4b839c6ca9a1388ca1a7a4b288506121,https://legiscan.com/NY/bill/A04465/2025,2025-02-04,1,2026-01-07,referred to judiciary,Establishes a housing court for actions and proceedings involving the enforcement of state and local laws for the establishment and maintenance of housing standards; makes related provisions.,Establishes a housing court for actions and proceedings involving the enforcement of state and local laws for the establishment and maintenance of housing standards; makes related provisions.
1953594,A04475,34df3b9a810365c751933a2e595f342a,https://legiscan.com/NY/bill/A04475/2025,2025-02-04,1,2026-01-07,referred to energy,Establishes the power authority of the state of New York shall make low cost hydropower available to hospitals and municipal housing authorities located within Niagara County.,Establishes the power authority of the state of New York shall make low cost hydropower available to hospitals and municipal housing authorities located within Niagara County.
1954983,A04537,b28724a04808fdeff0c5764c18f2b2a1,https://legiscan.com/NY/bill/A04537/2025,2025-02-04,1,2026-01-07,"referred to corporations, authorities and commissions",Relates to establishing ground rent rebates for eligible homeowners and renters in the Battery Park project area; provides for a rebate program; provides for a process for application and certification.,Relates to establishing ground rent rebates for eligible homeowners and renters in the Battery Park project area; provides for a rebate program; provides for a process for application and certification.
1954375,A04554,7a3a63139ef0955320e16bda7359a3d9,https://legiscan.com/NY/bill/A04554/2025,2025-02-04,1,2026-01-07,referred to real property taxation,"Authorizes the city of Niagara Falls to add unpaid housing code violation penalties, costs and fines to such city's annual tax levy.","Authorizes the city of Niagara Falls to add unpaid housing code violation penalties, costs and fines to such city's annual tax levy."
1954869,A04556,57c9f096f67ed0506c2077d37d56353f,https://legiscan.com/NY/bill/A04556/2025,2025-02-04,1,2026-01-07,"referred to corporations, authorities and commissions","Relates to providing residents of municipal public housing in the state with free basic cable and high-speed internet service, and reimbursing internet service providers and cable television companies for providing such service.","Relates to providing residents of municipal public housing in the state with free basic cable and high-speed internet service, and reimbursing internet service providers and cable television companies for providing such service."
1954673,A04568,53c0a277da04ee59ba74ac764d5ffc65,https://legiscan.com/NY/bill/A04568/2025,2025-02-04,1,2026-01-07,referred to housing,Establishes the New York state short-term rental property commission which shall assess and address the current housing stock in the state of New York and the state of short-term rental property regulation.,Establishes the New York state short-term rental property commission which shall assess and address the current housing stock in the state of New York and the state of short-term rental property regulation.
1954780,A04586,7c1d1acc7bc64fcecc850a1f6ac35cfc,https://legiscan.com/NY/bill/A04586/2025,2025-02-04,1,2026-01-07,referred to housing,Requires the New York city housing authority to repair certain conditions within thirty days of receipt of a written notice requesting such repairs; requires NYCHA to convert from gas to electric appliances when repairing or replacing any such appliances.,Requires the New York city housing authority to repair certain conditions within thirty days of receipt of a written notice requesting such repairs; requires NYCHA to convert from gas to electric appliances when repairing or replacing any such appliances.
1963059,A04877,5c0b66fed226d09568a103cd495adf58,https://legiscan.com/NY/bill/A04877/2025,2025-02-07,1,2026-01-07,referred to housing,"Relates to enacting the rent emergency stabilization for tenants act on local determinations of a housing emergency; authorizes a city with a population of one million or more to declare an emergency as to any class of housing accommodations if the vacancy rate for the housing accommodations in such class within such municipality is not in excess of five percent and a declaration of emergency may be made as to all housing accommodations if the vacancy rate for the housing accommodations within such municipality is not in excess of five percent; authorizes other cities, towns and villages to declare a housing emergency after considering publicly available data and holding public hearings.","Relates to enacting the rent emergency stabilization for tenants act on local determinations of a housing emergency; authorizes a city with a population of one million or more to declare an emergency as to any class of housing accommodations if the vacancy rate for the housing accommodations in such class within such municipality is not in excess of five percent and a declaration of emergency may be made as to all housing accommodations if the vacancy rate for the housing accommodations within such municipality is not in excess of five percent; authorizes other cities, towns and villages to declare a housing emergency after considering publicly available data and holding public hearings."
1963895,A04893,0c814fa9155ca9666d90b941e9cecfee,https://legiscan.com/NY/bill/A04893/2025,2025-02-10,1,2026-01-07,referred to housing,"Establishes the manufactured home community preservation act to provide financial and technical assistance, within funds available to counties, municipalities, rural preservation companies, and other non-profit housing organizations for their housing preservation efforts; provides that funds in the mortgage insurance fund can be used to provide financial support to local governments and eligible non-profit housing organizations.","Establishes the manufactured home community preservation act to provide financial and technical assistance, within funds available to counties, municipalities, rural preservation companies, and other non-profit housing organizations for their housing preservation efforts; provides that funds in the mortgage insurance fund can be used to provide financial support to local governments and eligible non-profit housing organizations."
1963719,A04954,6c66c2ba0ca1384239c4eda3819cb08d,https://legiscan.com/NY/bill/A04954/2025,2025-02-10,1,2025-12-08,enacting clause stricken,Relates to the conversion to condominium ownership for the preservation of expiring affordable housing in the city of New York; provides expanded homeownership opportunities from the conversion of certain residential rental buildings to condominium status by property owners that commit to preserve the inventory of expiring affordable housing in the city of New York.,Relates to the conversion to condominium ownership for the preservation of expiring affordable housing in the city of New York; provides expanded homeownership opportunities from the conversion of certain residential rental buildings to condominium status by property owners that commit to preserve the inventory of expiring affordable housing in the city of New York.
1964017,A04957,af0765ff00a7ad0de10d7c3d728481f7,https://legiscan.com/NY/bill/A04957/2025,2025-02-10,1,2026-01-07,referred to housing,Authorizes the New York city council to oversee the activities of the New York city housing authority.,Authorizes the New York city council to oversee the activities of the New York city housing authority.
1963996,A04965,ef6339da786e3f4ab8c62711fd60814c,https://legiscan.com/NY/bill/A04965/2025,2025-02-10,1,2026-01-07,referred to housing,Establishes a five-year moratorium on foreign entities purchasing homes in New York state unless the purchase is for a primary residence; directs the department of state to conduct a study on the effects of the moratorium on the housing market and to send a report on the study to the legislature; specifies data and indicators to analyze for the study; defines terms.,Establishes a five-year moratorium on foreign entities purchasing homes in New York state unless the purchase is for a primary residence; directs the department of state to conduct a study on the effects of the moratorium on the housing market and to send a report on the study to the legislature; specifies data and indicators to analyze for the study; defines terms.
1963835,A05021,09fb3de7cb5c1a6782090321d11a15d6,https://legiscan.com/NY/bill/A05021/2025,2025-02-10,1,2026-01-07,referred to aging,Enacts the New York state senior housing opportunities partnership act; establishes the New York state senior housing opportunities partnership authority; provides that such authority will finance or collaborate in the financing of senior housing opportunities facility projects.,Enacts the New York state senior housing opportunities partnership act; establishes the New York state senior housing opportunities partnership authority; provides that such authority will finance or collaborate in the financing of senior housing opportunities facility projects.
1965357,A05033,3897d8f8b29424c2a81b01631292c34d,https://legiscan.com/NY/bill/A05033/2025,2025-02-11,1,2026-01-07,referred to real property taxation,"Authorizes the City of Newburgh to add unpaid housing code violation penalties, costs and fines to such city's annual tax levy in accordance with applicable law.","Authorizes the City of Newburgh to add unpaid housing code violation penalties, costs and fines to such city's annual tax levy in accordance with applicable law."
1966338,A05108,b2883f311111480fba824d15c2645ca8,https://legiscan.com/NY/bill/A05108/2025,2025-02-12,1,2026-01-07,referred to governmental operations,Establishes the housing for an equitable reentry and opportunity (HERO) act to prohibit housing discrimination on the basis of criminal legal system involvement; defines criminal legal system involvement.,Establishes the housing for an equitable reentry and opportunity (HERO) act to prohibit housing discrimination on the basis of criminal legal system involvement; defines criminal legal system involvement.
1967296,A05121,d7ef81e2e9e7ddf6306ca19b4f2b20c8,https://legiscan.com/NY/bill/A05121/2025,2025-02-12,1,2026-01-07,referred to housing,Requires public residential buildings that receive funding through the department of housing and urban development or the division of housing and community renewal to have a supply of at least one dose of naloxone readily accessible for residential use as provided by OASAS.,Requires public residential buildings that receive funding through the department of housing and urban development or the division of housing and community renewal to have a supply of at least one dose of naloxone readily accessible for residential use as provided by OASAS.
1967345,A05177,aa2be75343cff51da59d941a13f62b3b,https://legiscan.com/NY/bill/A05177/2025,2025-02-12,1,2026-01-07,referred to ways and means,Establishes a fund for the creation of affordable housing for veterans and seniors.,Establishes a fund for the creation of affordable housing for veterans and seniors.
1967319,A05291,9253c32bbaf276fc5fd98c037cb7833b,https://legiscan.com/NY/bill/A05291/2025,2025-02-12,1,2026-01-07,referred to governmental operations,Requires local boards and the division of housing and community renewal to submit certain residential housing and zoning information to the department of state annually; requires such information to be published by the department of state on its website.,Requires local boards and the division of housing and community renewal to submit certain residential housing and zoning information to the department of state annually; requires such information to be published by the department of state on its website.
1969724,A05325,58364cf4a512b373cdb3e1a155e4d254,https://legiscan.com/NY/bill/A05325/2025,2025-02-13,1,2026-01-07,referred to environmental conservation,Excludes from reporting requirements relating to environmental quality reviews actions to approve the siting or construction of housing in cities with a population of one million or more.,Excludes from reporting requirements relating to environmental quality reviews actions to approve the siting or construction of housing in cities with a population of one million or more.
1969968,A05381,d3a0d40132297f74ec7fea67061965d1,https://legiscan.com/NY/bill/A05381/2025,2025-02-13,1,2026-01-07,referred to housing,"Requires annual audits of limited-profit housing companies to be made by the department of housing and community renewal, in conjunction with the New York city department of housing preservation and development.","Requires annual audits of limited-profit housing companies to be made by the department of housing and community renewal, in conjunction with the New York city department of housing preservation and development."
1969422,A05401,c62bcf4d1f689c6676a429737f57fe32,https://legiscan.com/NY/bill/A05401/2025,2025-02-13,1,2026-02-26,reported referred to ways and means,Requires annual inspections of Mitchell-Lama buildings; requires the appointment of housing management representatives to perform such inspections; requires notification of violations to housing companies; requires such housing companies to certify correction of violations.,Requires annual inspections of Mitchell-Lama buildings; requires the appointment of housing management representatives to perform such inspections; requires notification of violations to housing companies; requires such housing companies to certify correction of violations.
1970923,A05420,eed2609f55fc0bf6102608938c656759,https://legiscan.com/NY/bill/A05420/2025,2025-02-14,1,2026-01-07,referred to ways and means,"Requires menstrual products to be provided in drop-in centers, intake shelters and emergency congregate housing.","Requires menstrual products to be provided in drop-in centers, intake shelters and emergency congregate housing."
1970962,A05425,6d7e67148fd3e5cfb296f9ec758fb41d,https://legiscan.com/NY/bill/A05425/2025,2025-02-14,1,2026-01-07,referred to governmental operations,"Enacts the ""New York State buy North American act"" which requires the state, municipalities, public authorities and covered affordable housing projects to award contracts for the supply of manufactured products used in building projects to bidders who produce such manufactured products used in building projects primarily in North America; defines terms; makes related provisions.","Enacts the ""New York State buy North American act"" which requires the state, municipalities, public authorities and covered affordable housing projects to award contracts for the supply of manufactured products used in building projects to bidders who produce such manufactured products used in building projects primarily in North America; defines terms; makes related provisions."
1970718,A05463,264afaab3c75647807cca49bcab26325,https://legiscan.com/NY/bill/A05463/2025,2025-02-14,1,2026-01-07,referred to real property taxation,"Authorizes municipalities in the county of Orange to add unpaid housing code violation penalties, costs and fines to such municipalities' annual tax levy in accordance with applicable law.","Authorizes municipalities in the county of Orange to add unpaid housing code violation penalties, costs and fines to such municipalities' annual tax levy in accordance with applicable law."
1970945,A05483,a60de6027298169eba2ad7405575bbcb,https://legiscan.com/NY/bill/A05483/2025,2025-02-14,1,2026-01-07,referred to education,Prohibits the permanent or temporary housing of migrant populations in schoolhouses or on school grounds in districts outside of a city with a population of one million or more.,Prohibits the permanent or temporary housing of migrant populations in schoolhouses or on school grounds in districts outside of a city with a population of one million or more.
1970908,A05497,1c94318d4685c39296ee31afc48e5153,https://legiscan.com/NY/bill/A05497/2025,2025-02-14,1,2026-01-07,referred to ways and means,Clarifies the exemption for cooperative housing corporations where there is no change in beneficial ownership.,Clarifies the exemption for cooperative housing corporations where there is no change in beneficial ownership.
1970623,A05504,d93eb8db91f09c611c3d2e8242de961c,https://legiscan.com/NY/bill/A05504/2025,2025-02-14,1,2026-01-07,referred to housing,"Requires, in cities having a population of one million or more, supportive housing be disbursed throughout the boroughs of such city in proportion to the borough population.","Requires, in cities having a population of one million or more, supportive housing be disbursed throughout the boroughs of such city in proportion to the borough population."
1970630,A05533,16583dca611eadfd3fd3f423fbbfec50,https://legiscan.com/NY/bill/A05533/2025,2025-02-14,1,2026-01-07,referred to housing,Provides for tenant responses to applications for a major capital improvement rent increase; allows tenants to respond within one hundred twenty days from the date of mailing of a notice of a proceeding; requires the state division of housing and community renewal to provide any responding tenant with the reasons for the division's approval or denial of such application.,Provides for tenant responses to applications for a major capital improvement rent increase; allows tenants to respond within one hundred twenty days from the date of mailing of a notice of a proceeding; requires the state division of housing and community renewal to provide any responding tenant with the reasons for the division's approval or denial of such application.
