bill_id,number,change_hash,url,status_date,status,last_action_date,last_action,title,description
2121315,A10287,1ff111a28f72496645a64e70c940ff01,https://legiscan.com/NY/bill/A10287/2025,2026-02-20,1,2026-02-20,referred to housing,Includes positive rental payment information reporting as a preference in the evaluation of project applications in the New York state low income housing tax credit program; requires landlords to offer tenants the option of positive rental payment information reporting; creates notice requirements for the election of positive rental payment information reporting.,Includes positive rental payment information reporting as a preference in the evaluation of project applications in the New York state low income housing tax credit program; requires landlords to offer tenants the option of positive rental payment information reporting; creates notice requirements for the election of positive rental payment information reporting.
2121364,A10300,88d9161345a4cf037608997afd760438,https://legiscan.com/NY/bill/A10300/2025,2026-02-20,1,2026-02-20,referred to children and families,"Directs the office of children and family services to conduct a statewide needs assessment to identify any unmet needs, including, but not limited to, housing, mental health access, financial assistance, childcare, and respite care access for kinship caregivers.","Directs the office of children and family services to conduct a statewide needs assessment to identify any unmet needs, including, but not limited to, housing, mental health access, financial assistance, childcare, and respite care access for kinship caregivers."
2121219,A10311,2161048373790ae10b8cf8af001a7ba1,https://legiscan.com/NY/bill/A10311/2025,2026-02-20,1,2026-02-20,referred to housing,Requires a hearing by the Department of Housing Preservation and Development of the City of New York or the Division of Housing and Community Renewal where a family member applies and is denied by a housing company to succeed a lease or sublease.,Requires a hearing by the Department of Housing Preservation and Development of the City of New York or the Division of Housing and Community Renewal where a family member applies and is denied by a housing company to succeed a lease or sublease.
2121317,A10336,37eca943bdee12638b357ca3e678ecc7,https://legiscan.com/NY/bill/A10336/2025,2026-02-20,1,2026-02-24,print number 10336a,"Authorizes the state university of New York trustees are hereby authorized and empowered, without any public bidding, to lease and otherwise contract to make available to the Abby Lane Housing Corporation, a not-for-profit corporation, a portion of the lands of the university for the purpose of building undergraduate and graduate student housing.","Authorizes the state university of New York trustees are hereby authorized and empowered, without any public bidding, to lease and otherwise contract to make available to the Abby Lane Housing Corporation, a not-for-profit corporation, a portion of the lands of the university for the purpose of building undergraduate and graduate student housing."
2125889,A10355,b049f0e1f186356c0ddd7d73295aa091,https://legiscan.com/NY/bill/A10355/2025,2026-02-26,1,2026-02-26,referred to governmental employees,"Permits an eligible retirement system member to receive, in lieu of an ordinary death benefit, a death benefit such member would otherwise be entitled to receive provided such member is a state-paid judge or justice of the unified court system or a housing judge of the civil court of the city of New York.","Permits an eligible retirement system member to receive, in lieu of an ordinary death benefit, a death benefit such member would otherwise be entitled to receive provided such member is a state-paid judge or justice of the unified court system or a housing judge of the civil court of the city of New York."
2127536,A10366,29b42cd65466fe074a0258fa5571aacf,https://legiscan.com/NY/bill/A10366/2025,2026-03-02,1,2026-03-02,"referred to tourism, parks, arts and sports development","Establishes the large projects historic rehabilitation tax credit and the ""white elephant"" housing historic rehabilitation projects tax credit program for qualified rehabilitation expenditures totaling fifty million dollars or more with respect to a certified historic structure that has been vacant, as determined by local code enforcement or other reasonable means, for at least ten of fifteen consecutive years preceding the date of the taxpayer's application for the rehabilitation credit.","Establishes the large projects historic rehabilitation tax credit and the ""white elephant"" housing historic rehabilitation projects tax credit program for qualified rehabilitation expenditures totaling fifty million dollars or more with respect to a certified historic structure that has been vacant, as determined by local code enforcement or other reasonable means, for at least ten of fifteen consecutive years preceding the date of the taxpayer's application for the rehabilitation credit."
2016247,K00280,215740ab36a09b4e8603f04430511eba,https://legiscan.com/NY/bill/K00280/2025,2025-04-01,4,2025-04-01,adopted,"Memorializing Governor Kathy Hochul to proclaim April 2025, as Fair Housing Month in the State of New York","Memorializing Governor Kathy Hochul to proclaim April 2025, as Fair Housing Month in the State of New York"
2037360,K00813,80acf456db51dc5b100850d70d1809a8,https://legiscan.com/NY/bill/K00813/2025,2025-06-16,4,2025-06-16,adopted,"Commending Churches United for Fair Housing upon the occasion of hosting its Annual Gala on December 9, 2025","Commending Churches United for Fair Housing upon the occasion of hosting its Annual Gala on December 9, 2025"
1897961,S00023,5479e2ef34db8d17e4166a946335c68d,https://legiscan.com/NY/bill/S00023/2025,2025-01-08,1,2026-01-07,REFERRED TO BUDGET AND REVENUE,Expands a certain tax credit for farmers to include the cost of construction of housing for farm workers.,Expands a certain tax credit for farmers to include the cost of construction of housing for farm workers.
1898107,S00072,3a24d1cbd5277e8e235fc1d86bcd19e6,https://legiscan.com/NY/bill/S00072/2025,2025-01-08,1,2026-01-07,"REFERRED TO HOUSING, CONSTRUCTION AND COMMUNITY DEVELOPMENT",Relates to establishing the housing access voucher program; provides that the commissioner of the division of housing and community renewal shall implement a program of rental assistance in the form of housing vouchers for eligible individuals and families who are homeless or who face an imminent loss of housing; provides that the commissioner shall designate housing access voucher local administrators in the state to administer the program.,Relates to establishing the housing access voucher program; provides that the commissioner of the division of housing and community renewal shall implement a program of rental assistance in the form of housing vouchers for eligible individuals and families who are homeless or who face an imminent loss of housing; provides that the commissioner shall designate housing access voucher local administrators in the state to administer the program.
1897951,S00107,53e48b1378d0fbe641a7e8f7969beb2c,https://legiscan.com/NY/bill/S00107/2025,2025-01-08,1,2026-01-07,"REFERRED TO HOUSING, CONSTRUCTION AND COMMUNITY DEVELOPMENT",Relates to the right of tenant association to have the first option to purchase a housing unit.,Relates to the right of tenant association to have the first option to purchase a housing unit.
1898024,S00124,eff540d406708a52e780d67bedd8a2d9,https://legiscan.com/NY/bill/S00124/2025,2025-01-08,1,2026-01-07,REFERRED TO JUDICIARY,Establishes a housing court for actions and proceedings involving the enforcement of state and local laws for the establishment and maintenance of housing standards; makes related provisions.,Establishes a housing court for actions and proceedings involving the enforcement of state and local laws for the establishment and maintenance of housing standards; makes related provisions.
1897867,S00136,1b2e64e00759f3680bb2d47e67e64ec3,https://legiscan.com/NY/bill/S00136/2025,2025-01-08,1,2026-01-07,REFERRED TO SOCIAL SERVICES,Establishes a five-year window for any entity participating in the New York state supportive housing program (NYSSHP) in good standing with such program to participate in a request for proposal to increase their contract rates up to ESSHI levels.,Establishes a five-year window for any entity participating in the New York state supportive housing program (NYSSHP) in good standing with such program to participate in a request for proposal to increase their contract rates up to ESSHI levels.
1897928,S00168,3766b1259161e14804e5c661c58812e9,https://legiscan.com/NY/bill/S00168/2025,2025-01-08,1,2026-01-07,REFERRED TO SOCIAL SERVICES,"Makes migrant youth under the age of 25 who are receiving runaway and homeless youth services eligible to receive housing vouchers under the family homelessness and eviction prevention supplement (""FHEPS"") program.","Makes migrant youth under the age of 25 who are receiving runaway and homeless youth services eligible to receive housing vouchers under the family homelessness and eviction prevention supplement (""FHEPS"") program."
1898549,S00240,e431fa90cf3e7ffcd4a2c5a7560e2953,https://legiscan.com/NY/bill/S00240/2025,2025-03-11,2,2026-02-03,referred to housing,Relates to unlawful tenancies under the emergency tenant protection act of 1974; prohibits owners from entering or renewing leases where such owner has reason to know that such tenant will not occupy the housing accommodation as the tenant's primary residence.,Relates to unlawful tenancies under the emergency tenant protection act of 1974; prohibits owners from entering or renewing leases where such owner has reason to know that such tenant will not occupy the housing accommodation as the tenant's primary residence.
1898552,S00248,35e8bd2df1486600c7985015f85dfcf7,https://legiscan.com/NY/bill/S00248/2025,2025-01-08,1,2026-01-07,"REFERRED TO COMMERCE, ECONOMIC DEVELOPMENT AND SMALL BUSINESS","Defines community significant projects as a business creating or retaining current jobs as determined by the commissioner, with particular emphasis on employment and/or training of current public housing residents; currently located or to be located in existing leased space of a building in a public housing development in the state; and which makes significant qualified capital investments to start a business, or improve services and working conditions for an existing business, when located in such public housing space and including such projects in the excelsior jobs program.","Defines community significant projects as a business creating or retaining current jobs as determined by the commissioner, with particular emphasis on employment and/or training of current public housing residents; currently located or to be located in existing leased space of a building in a public housing development in the state; and which makes significant qualified capital investments to start a business, or improve services and working conditions for an existing business, when located in such public housing space and including such projects in the excelsior jobs program."
1898718,S00256,0744f8636f6e3e1784ac81471fb97440,https://legiscan.com/NY/bill/S00256/2025,2025-01-08,1,2026-01-07,REFERRED TO LOCAL GOVERNMENT,"Provides that a policy of this state should be to increase housing options and opportunities, including but not limited to affordable, and workforce and senior housing.","Provides that a policy of this state should be to increase housing options and opportunities, including but not limited to affordable, and workforce and senior housing."
1900287,S00401,b5d2d04a6702ae706ac695338038901e,https://legiscan.com/NY/bill/S00401/2025,2025-01-08,1,2026-01-07,"REFERRED TO HOUSING, CONSTRUCTION AND COMMUNITY DEVELOPMENT","Establishes the ""tenant opportunity to purchase act""; prevents the displacement of middle and lower-income tenants in New York and preserves affordable housing by providing an opportunity for tenants to own or remain renters in the properties in which they reside.","Establishes the ""tenant opportunity to purchase act""; prevents the displacement of middle and lower-income tenants in New York and preserves affordable housing by providing an opportunity for tenants to own or remain renters in the properties in which they reside."
1900513,S00450,d31c5ded1b245c98f2b417c8f77d9ff5,https://legiscan.com/NY/bill/S00450/2025,2025-05-13,2,2025-06-10,ordered to third reading rules cal.548,Prohibits landlords from including incorrect information relating to rent decontrol in certain leases and renewals thereof; imposes a violation punishable by a fine of $1000 for a violation by a landlord; requires the standardization of certain notices pertaining to units subject to the Affordable New York Housing Program.,Prohibits landlords from including incorrect information relating to rent decontrol in certain leases and renewals thereof; imposes a violation punishable by a fine of $1000 for a violation by a landlord; requires the standardization of certain notices pertaining to units subject to the Affordable New York Housing Program.
1900854,S00529,a0c1e1b4bc12d84550fad5c0bdc5e8fe,https://legiscan.com/NY/bill/S00529/2025,2025-01-08,1,2026-01-07,"REFERRED TO HOUSING, CONSTRUCTION AND COMMUNITY DEVELOPMENT","Establishes the local initiatives task force on housing, in order to collaborate with local government officials, state agencies, and stakeholders to develop best practices for local governments to incentivize housing development.","Establishes the local initiatives task force on housing, in order to collaborate with local government officials, state agencies, and stakeholders to develop best practices for local governments to incentivize housing development."
1900918,S00538,c533c28fdd2ae72b5b4628997950de2e,https://legiscan.com/NY/bill/S00538/2025,2025-01-08,1,2026-01-07,"REFERRED TO HOUSING, CONSTRUCTION AND COMMUNITY DEVELOPMENT",Prohibits persons whose income is greater than one hundred twenty-five percent of the area median income from occupying certain housing accommodations.,Prohibits persons whose income is greater than one hundred twenty-five percent of the area median income from occupying certain housing accommodations.
1901016,S00572,d1ca7be4e5b82efbbb6f4ca0c6149060,https://legiscan.com/NY/bill/S00572/2025,2025-01-08,1,2025-01-08,REFERRED TO LOCAL GOVERNMENT,"Authorizes cities and towns, except a city with a population of one million or more, to establish community housing funds; authorizes such cities and towns to impose a real estate transfer tax with revenues to be deposited in such funds; makes related provisions.","Authorizes cities and towns, except a city with a population of one million or more, to establish community housing funds; authorizes such cities and towns to impose a real estate transfer tax with revenues to be deposited in such funds; makes related provisions."
1900956,S00576,27a9708ba07bfc73f7945dfc0c418ddf,https://legiscan.com/NY/bill/S00576/2025,2025-01-08,1,2026-01-07,REFERRED TO INVESTIGATIONS AND GOVERNMENT OPERATIONS,"Establishes a manufactured housing tax credit which provides for a credit of up to two thousand dollars for each new manufactured home that the taxpayer constructed and for which a certificate of occupancy has been issued on or after January first, two thousand twenty-five and on or before December thirty-first, two thousand thirty-one.","Establishes a manufactured housing tax credit which provides for a credit of up to two thousand dollars for each new manufactured home that the taxpayer constructed and for which a certificate of occupancy has been issued on or after January first, two thousand twenty-five and on or before December thirty-first, two thousand thirty-one."
1901027,S00595,1aef24d70fca03977b04664e7fc106cc,https://legiscan.com/NY/bill/S00595/2025,2025-06-11,2,2026-02-25,REPORTED AND COMMITTED TO FINANCE,Establishes the small rental housing development initiative to provide funding to eligible applicants to construct small rental housing developments in eligible areas.,Establishes the small rental housing development initiative to provide funding to eligible applicants to construct small rental housing developments in eligible areas.
1901360,S00673,d244a5479999e0383bbe991df2b5e3d6,https://legiscan.com/NY/bill/S00673/2025,2025-01-08,1,2026-01-07,REFERRED TO SOCIAL SERVICES,Establishes the housing people and animals together grant program to expand access for co-sheltering people experiencing homelessness and victims of domestic violence with companion animals.,Establishes the housing people and animals together grant program to expand access for co-sheltering people experiencing homelessness and victims of domestic violence with companion animals.
1901446,S00679,a1a007978a31bf627cf74043db2b79a4,https://legiscan.com/NY/bill/S00679/2025,2025-01-08,1,2026-01-07,"REFERRED TO CORPORATIONS, AUTHORITIES AND COMMISSIONS","Establishes the affordable housing broadband assistance grant program within the division of broadband access to support no-cost and/or discounted subscriptions for households receiving federal, state, or local housing assistance or residing in housing units designated for low-income and/or vulnerable populations.","Establishes the affordable housing broadband assistance grant program within the division of broadband access to support no-cost and/or discounted subscriptions for households receiving federal, state, or local housing assistance or residing in housing units designated for low-income and/or vulnerable populations."
1902170,S00733,954353196efaddc217f1340bcfc952de,https://legiscan.com/NY/bill/S00733/2025,2025-01-08,1,2026-01-07,"REFERRED TO HOUSING, CONSTRUCTION AND COMMUNITY DEVELOPMENT",Establishes a housing project revolving loan program and housing project revolving loan fund to encourage the development of mixed income housing by providing zero-percent interest or low-interest loans.,Establishes a housing project revolving loan program and housing project revolving loan fund to encourage the development of mixed income housing by providing zero-percent interest or low-interest loans.
1902115,S00735,0314318c795b8bbedae9ae2921e76850,https://legiscan.com/NY/bill/S00735/2025,2025-01-08,1,2025-01-14,SUBSTITUTED BY A420,"Increases the New York state housing finance agency bonding authority to $36,280,000,000.","Increases the New York state housing finance agency bonding authority to $36,280,000,000."
1902357,S00851,7b44155789bdd7f4ca101f967d060601,https://legiscan.com/NY/bill/S00851/2025,2025-01-08,1,2026-01-07,REFERRED TO INVESTIGATIONS AND GOVERNMENT OPERATIONS,Establishes a housing infrastructure tax credit to provide a credit of up to ten percent of costs for infrastructure projects related to the construction of new homes or multiple dwellings commenced and completed within a specific time period.,Establishes a housing infrastructure tax credit to provide a credit of up to ten percent of costs for infrastructure projects related to the construction of new homes or multiple dwellings commenced and completed within a specific time period.
1902819,S00871,fe0fcd02567cff4bca7dce9181ff5b29,https://legiscan.com/NY/bill/S00871/2025,2025-05-13,2,2026-03-04,ADVANCED TO THIRD READING,Establishes uniform waiting list priorities for domestic violence survivors applying for public housing.,Establishes uniform waiting list priorities for domestic violence survivors applying for public housing.
1902655,S00880,4d65fc8c0cc5bfa3c0f8e61fe7e04831,https://legiscan.com/NY/bill/S00880/2025,2025-01-08,1,2026-01-07,"REFERRED TO HOUSING, CONSTRUCTION AND COMMUNITY DEVELOPMENT","Enacts the housing development fund company fairness, preservation, and affordability act to clarify certain provisions relating to the dissolution and reincorporation of housing development fund companies; provides for tax exemptions and abatements for housing development fund companies.","Enacts the housing development fund company fairness, preservation, and affordability act to clarify certain provisions relating to the dissolution and reincorporation of housing development fund companies; provides for tax exemptions and abatements for housing development fund companies."
1902762,S00891,1bee4646432ed3c036218ff52255a353,https://legiscan.com/NY/bill/S00891/2025,2025-01-08,1,2026-01-07,REFERRED TO SOCIAL SERVICES,"Directs the department of social services to establish a centralized homelessness crisis response data system through which state agencies, local governmental entities, including law enforcement agencies, court systems, school districts, and emergency service providers, and other relevant persons are able to share and access information related to individuals who experience chronic homelessness in order to connect or refer such individuals to services including affordable housing opportunities.","Directs the department of social services to establish a centralized homelessness crisis response data system through which state agencies, local governmental entities, including law enforcement agencies, court systems, school districts, and emergency service providers, and other relevant persons are able to share and access information related to individuals who experience chronic homelessness in order to connect or refer such individuals to services including affordable housing opportunities."
1902479,S00896,dc39c109a0f51410e5b6decac672664f,https://legiscan.com/NY/bill/S00896/2025,2025-05-21,2,2026-02-09,referred to governmental operations,"Requires the inclusion of local and municipal animal shelters, any duly incorporated society for the prevention of cruelty to animals and veterinary services when establishing local comprehensive emergency management plans; requires that information to the public include the communication accommodation needs of persons with vision or hearing impairments and information on which temporary housing and other necessary facilities are designated as animal-friendly.","Requires the inclusion of local and municipal animal shelters, any duly incorporated society for the prevention of cruelty to animals and veterinary services when establishing local comprehensive emergency management plans; requires that information to the public include the communication accommodation needs of persons with vision or hearing impairments and information on which temporary housing and other necessary facilities are designated as animal-friendly."
1903550,S00919,cfd5b013ec1d5700660ab059bb4acc14,https://legiscan.com/NY/bill/S00919/2025,2025-06-10,2,2026-03-05,1ST REPORT CAL.457,Requires local boards and the division of housing and community renewal to submit certain residential housing and zoning information to the department of state annually; requires such information to be published by the department of state on its website.,Requires local boards and the division of housing and community renewal to submit certain residential housing and zoning information to the department of state annually; requires such information to be published by the department of state on its website.
1903621,S00939,bd4f269eeb6d26d622c3a3e1e4ed33b7,https://legiscan.com/NY/bill/S00939/2025,2025-01-08,1,2026-02-10,REPORTED AND COMMITTED TO FINANCE,Establishes a fund for the creation of affordable housing for veterans and seniors.,Establishes a fund for the creation of affordable housing for veterans and seniors.
1903509,S00950,8edb12268bef73e7c836ad7e5201ef82,https://legiscan.com/NY/bill/S00950/2025,2025-01-08,1,2026-01-07,REFERRED TO AGRICULTURE,Requires a farm owner or operator that produces shell eggs or liquid eggs for human consumption to confine egg-laying hens in a cage-free housing system.,Requires a farm owner or operator that produces shell eggs or liquid eggs for human consumption to confine egg-laying hens in a cage-free housing system.
1903425,S00956,68eb27f0b99f6858b0c2f053b3dd4f22,https://legiscan.com/NY/bill/S00956/2025,2025-01-08,1,2026-02-13,"RECOMMIT, ENACTING CLAUSE STRICKEN",Establishes an affordable independent senior housing assistance program which shall provide grants within amounts appropriated or otherwise available therefor to affordable independent senior housing properties to establish and operate resident assistance programs.,Establishes an affordable independent senior housing assistance program which shall provide grants within amounts appropriated or otherwise available therefor to affordable independent senior housing properties to establish and operate resident assistance programs.
1903391,S00958,a92ccf9eac9a91d9e9fd6e0e5ca0b2a9,https://legiscan.com/NY/bill/S00958/2025,2025-01-08,1,2026-01-07,REFERRED TO SOCIAL SERVICES,Relates to making certain housing programs available regardless of immigration status; provides that local social services districts in a city with a population of five million or more shall be permitted to offer certain housing programs to individuals or families who would be eligible but for a federal law restricting eligibility based on immigration.,Relates to making certain housing programs available regardless of immigration status; provides that local social services districts in a city with a population of five million or more shall be permitted to offer certain housing programs to individuals or families who would be eligible but for a federal law restricting eligibility based on immigration.
